FHDI_Herb_ID,Herb_Latin_Name,Herb_English_Name,Herb_Pinyin_Name,Herb_Chinese_Name,Properties,Meridians ,Use_Part,Function ,Indication,Toxicity ,Therapeutic_Class,Therapeutic _Class_Chinese,HERB_ID,SymMap_ID,NPASS_ID,Taxonomy_ID,Superkingdom,Kingdom,Phylum,Class,Order,Family,Genus,Drug homologous food
H00533,Herba Artemisiae Anomalae,Siphonostegia,LIU JI NU,刘寄奴,Warm; Bitter,Spleen; Liver; Heart,Artemsia anomala S. Moore;Siphonostegia chinensis Benth.,"Treatment of: 1. Blood stagnation manifested as dysmenorrhea, amenorrhea, postpartum abdominal pain or swelling and pain due to external injuries. Siphonostegia (Liujinu) is used with Chinese angelica root (Danggui), Corydalis tuber (Yanhusuo) and Chuanxiong rhizome (Chuanxiong). 2. Hemorrhages and pain due to external injuries. The powder of Siphonostegia (Liujinu) is used alone, externally.","Treatment of: 1. Blood stagnation manifested as dysmenorrhea, amenorrhea, postpartum abdominal pain or swelling and pain due to external injuries. Siphonostegia (Liujinu) is used with Chinese angelica root (Danggui), Corydalis tuber (Yanhusuo) and Chuanxi",NA,Blood activation and stasis removal,活血化淤,HERB003451,NA,NPO13559,714449,Eukaryota,Viridiplantae,Streptophyta,Magnoliopsida,Asterales,Asteraceae,Artemisia,NA
H00534,Massa Medicata Fermentata,Medicated Leaven,LIU SHEN QU,六神曲,Warm; Pungent; Sweet,Spleen; Stomach,NA,"Treatment of retention of food manifested as epigastric and abdominal distension and fullness, no appetite, gurgling sound and diarrhea. Medicated leaven (Shenqu) is used with Hawthorn fruit (Shanzha) and Germinated barley (Maiya).","Treatment of retention of food manifested as epigastric and abdominal distension and fullness, no appetite, gurgling sound and diarrhea. Medicated leaven (Shenqu) is used with Hawthorn fruit (Shanzha) and Germinated barley (Maiya).",NA,Food digestion,消食,HERB003461,NA,NPO11035,NA,NA,NA,NA,NA,NA,NA,NA,NA
H00535,Ixora chinensis,Chinese Ixora,LONG CHUAN HUA,龙船花,NA,NA,flower,"To clear heat and cool blood, dissipate stasis and relieve pain.","Hypertension, menstrual disorder, amenorrhea, knocks and falls, swelling of sores and boils.",NA,NA,NA,HERB003477,NA,NPO7510,591727,Eukaryota,Viridiplantae,Streptophyta,Magnoliopsida,Gentianales,Rubiaceae,Ixora,NA
H00536,NA,Gentiae Radix Et Rhozima,LONG DAN,龙胆,NA,NA,root and rhizome,NA,"Acute icterohepatitis, urinary tract infection, acute conjunctivitis, dribbling pain of urination, damp-heat jaundice, genital swelling and itch, damp-heat vaginal discharge, distended head and headache due to liver-gallbladder repletion fire, red eyes with gall, deafness, swelling in ear, pain in rib-side, bitter taste, fright wind and convulsion.",NA,Heat-Clearing And Dampnessdrying Medicinal,清热燥湿药,HERB003478,251,NA,NA,NA,NA,NA,NA,NA,NA,NA,NA
H00537,Os Draconis,"Dragon's bone, Fossilized bone",LONG GU,龙骨,Mild; Sweet; Punkery,Large Intestine; Liver; Heart; Kidney,NA,"Treatment of: 1. Deficient yin of the liver and kidneys with hyperactive yang of the liver manifested as dizziness, vertigo, blurred vision or irritability. Dragon's bone (Longgu) is used with Oyster shell (Muli), Red ochre (Daizheshi) and White peony root (Baishao) in the formula Zhengan Xifeng Tang. 2. Seminal emissions due to deficient kidneys. Dragon's bone (Longgu) is used with Oyster shell (Muli), Flattened milkvetch seed (Shayuanzi) and Euryale seed (Qianshi). 3. Palpitations and insomnia. Dragon's bone (Longgu) is used with Oyster shell (Muli), Polygala root (Yuanzhi) and Wild jujube seed (Suanzaoren). 4. Leukorrhea due to deficient kidneys. Dragon's bone (Longgu) is used with Oyster shell (Muli), Dioscorea (Shanyao) and Cuttlefish bone (Wuzeigu). 5. Spontaneous sweating and night sweating. Dragon's bone (Longgu) is used with Oyster shell (Muli) and Schisandra fruit (Wuweizi).","Treatment of: 1. Deficient yin of the liver and kidneys with hyperactive yang of the liver manifested as dizziness, vertigo, blurred vision or irritability. Dragon's bone (Longgu) is used with Oyster shell (Muli), Red ochre (Daizheshi) and White peony roo",NA,Spirit calming,安神,HERB003480,NA,NPO13037,NA,NA,NA,NA,NA,NA,NA,NA,NA
H00538,Solanum nigrum L.,Solanum Nigrum Linn.,LONG KUI,龙葵,NA,NA,aerial parts,NA,"Clove sore, swollen welling abscess, erysipelas, sprain from knocks and falls, mastitis, cervicitis, chronic bronchitis, chronic trachitis, acute nephritis, dysentery, infection of skin, leukorrhea, scant urine in children.",NA,Antipyretic Detoxicate Drugs,清热解毒药,HERB003482,252,NA,4112,Eukaryota,Viridiplantae,Streptophyta,Magnoliopsida,Solanales,Solanaceae,Solanum,NA
H00539,Solanum nigrum L.,Semen Solani nigri,LONG KUI ZI,龙葵子,NA,NA,NA,NA,NA,NA,NA,NA,HERB003484,NA,NA,4112,Eukaryota,Viridiplantae,Streptophyta,Magnoliopsida,Solanales,Solanaceae,Solanum,NA
H00541,Clerodendron cyrtophyllum,Manyflower Glorybower Leaf,LU BIAN QING,路边青,NA,NA,stem-leaf,"To clear heat and resolve toxin, cool blood and stanch bleeding.","Febrile diseases due to external contraction, exuberant heat and vexation thirst, swelling pain in throat, mouth sore, jaundice, heat toxin dysentery, acute enteritis, swelling toxin of welling abscess and flat abscess, spontaneous external bleeding, blood strangury, bleeding due to external injury.",NA,NA,NA,HERB003507,NA,NPO28301,2546024,Eukaryota,Viridiplantae,Streptophyta,Magnoliopsida,Gentianales,Gentianaceae,No Rank at Level Genus,NA
H00542,Rhaponticum carthamoides,Redflowered Swisscentaury,LU CAO,葎草,NA,NA,root,"To boost qi and fortify spleen, quiet spirit.","Fatigue hypodynamia, inappetence, neurasthenia.",NA,NA,NA,HERB003511,NA,NPO223,362630,Eukaryota,Viridiplantae,Streptophyta,Magnoliopsida,Asterales,Asteraceae,Leuzea,NA
H00543,Rhizoma Phragmitis,Reed rhizome ,LU GEN,芦根,Cold; Sweet,Lung; Stomach,rhizome,"To remove heat, to promote the production of body fluid, to relieve emesis, and to alleviate dysuria.","Febrile diseases with vexation and thirst, stomach heat vomiting, lung heat cough, pulmonary welling abscess, heat strangury with inhibited pain.",NA,Fire Purging Drugs,清热泻火药,HERB003526,255,NA,15745,Eukaryota,Viridiplantae,Streptophyta,Magnoliopsida,Poales,Poaceae,No Rank at Level Genus,NA
H00544,Aloe,Aloe,LU HUI,芦荟,Cold; Bitter,Large Intestine; Stomach; Liver,solid residue obtained by evaporating liquid which drains from leaves,1. To purge feces; 2. To clear heat in the liver; 3. To kill worms,"Constipation, child gan accumulation, ascariasis, fright wind, lichen.",NA,Offensive Purgative Medicinal,攻下药,HERB003528,256,NA,25641,Eukaryota,Viridiplantae,Streptophyta,Magnoliopsida,Asparagales,Asphodelaceae,No Rank at Level Genus,NA
H00545,Cornu Cervi,Deer Horn,LU JIAO,鹿角,Warm; Salty,Liver; Kidney,NA,For tonifying yang,NA,NA,For tonifying weakness,补虚,HERB003529,NA,NPO25192,NA,NA,NA,NA,NA,NA,NA,NA,NA
H00546,Fructus Liquidambaris,fruit of beautiful sweetgum,LU LU TONG,路路通,Mild; Bitter,Stomach; Liver; Kidney,inflorescence,"To dispel wind and remove obstruction from the collaterals, to cause diuresis, and to stimulate menstrual discharge.","Wind-damp impediment pain, numbness in limbs, hypertonicity of limbs, pain in stomach duct and abdomen, amenorrhea, galactostasis, edema distention fullness, eczema.",NA,Wind-Dampnessdispelling And Colddispersing Medicinal,祛风湿散寒药,HERB003535,258,NA,NA,NA,NA,NA,NA,NA,NA,NA,NA
H00547,Pyrrosia sheareri,Shearer’s Pyrrosia Frond,LU SHAN SHI WEI,庐山石韦,NA,NA,leaf,See Pyrrosia lingua.,See Pyrrosia lingua.,NA,NA,NA,HERB003539,NA,NPO29331,746523,Eukaryota,Viridiplantae,Streptophyta,Polypodiopsida,Polypodiales,Polypodiaceae,Pyrrosia,NA
H00548,Isodon rubescens var. lushanensis,Lushan Rabdosia,LU SHAN XIANG CHA CAI,庐山香茶菜,NA,NA,NA,NA,NA,NA,NA,NA,HERB003540,NA,NPO28626.1,587669,Eukaryota,Viridiplantae,Streptophyta,Magnoliopsida,Lamiales,Lamiaceae,Isodon,NA
H00549,Isodon rubescens var. lushiensis,Lushien Rabdosia,LU SHI DONG LING CAO,卢氏冬凌草,NA,NA,NA,NA,NA,NA,NA,NA,HERB003542,NA,NPO28626.2,587669,Eukaryota,Viridiplantae,Streptophyta,Magnoliopsida,Lamiales,Lamiaceae,Isodon,NA
H00550,herba pyrolae chinensis,all-grass Chinese pyrola,LU XIAN CAO,鹿衔草,Warm; Sweet; Bitter,Liver; Kidney,whole herb,"To relieve rheumatic conditions, to strengthen the tendons and bones, and to arrest bleeding.","Pulmonary infection, intestinal infection, urinary tract infection, infant diarrhea, acute dysentery, wind-damp impediment pain, lassitude in lumbus and knees, profuse menstruation, enduring cough.",NA,Wind-Dampnessdispelling And Colddispersing Medicinal,祛风湿散寒药,HERB003549,257,NA,NA,NA,NA,NA,NA,NA,NA,NA,NA
H00551,Apocynum venetum,Dogbane,LUO BU MA,罗布麻,Mild;  astringent; slightly cold,NA,whole herb,"To clear heat and calm liver, disinhibit water and disperse edema, check hyperactivity, lower blood pressure.","Cardiac failure, hypertension, edema, cirrhosis with ascites, edema in pregnancy, dizziness, headache, palpitation, insomnia, scant urine with edema, chronic bronchitis, influenza.",NA,For calming liver and containing wind,平肝息风,HERB003572,NA,NPO16145,377125,Eukaryota,Viridiplantae,Streptophyta,Magnoliopsida,Gentianales,Apocynaceae,Apocynum,NA
H00552,Rauvolfia verticillata,"Common Devilpepper Equivalent plant: Rauvolfia verticillata var hainanensis , Rauwolfia latifrons, Rauwolfia perakensis, Rauvolfia vomitoria, Rauvolfia verticillata f rubrocarpa",LUO FU MU,萝芙木,NA,NA,root,"To clear heat, lower blood pressure, quiet spirit.","Common cold with fever, headache and generalized pain, swelling pain in throat, hypertension, dizziness, insomnia, gan accumulation.",NA,NA,NA,HERB003578,NA,NPO30364,329875,Eukaryota,Viridiplantae,Streptophyta,Magnoliopsida,Gentianales,Apocynaceae,Rauvolfia,NA
H00553,Fructus Momordicae,Grosvenor Momordica Fruit,LUO HAN GUO,罗汉果,Cool; Sweet,Lung; Large Intestine,fruit,"To remove heat, moisten the lung and relax the bowels.","Lung heat dry cough, common cold, throat pain, laryngitis, aphonia due to throat pain, intestinal dry and constipation.",NA,Phlegresolving Medicine,化痰药,HERB003582,260,NA,3671,Eukaryota,Viridiplantae,Streptophyta,Magnoliopsida,Cucurbitales,Cucurbitaceae,No Rank at Level Genus,The herb belongs to a list of traditional Chinese medicines published by China's National Health Commission as both food and medicine
H00554,Arachis hypogaea,Peanut,LUO HUA SHENG,落花生,NA,NA,seed,"To fortify spleen and nourish stomach, moisten lung and transform phlegm.","Stomach reflux, scant breast milk, beriberi, lung heat dry cough, dry stool.",NA,NA,NA,HERB003586,NA,NPO25426,3818,Eukaryota,Viridiplantae,Streptophyta,Magnoliopsida,Fabales,Fabaceae,Arachis,NA
H00555,Arachis hypogaea,Peanut Branch-leaf,LUO HUA SHENG ZHI YE,落花生枝叶,NA,NA,branchlet-leaf,"To clear heat and resolve toxin, quiet heart and spirit, lower blood pressure.","Knocks and falls, sore toxin.",NA,NA,NA,HERB003589,NA,NPO25426,3818,Eukaryota,Viridiplantae,Streptophyta,Magnoliopsida,Fabales,Fabaceae,Arachis,NA
H00556,Caulis Trachelospermi,stem of Chinese starjasmine,LUO SHI TENG,络石藤,Minor cold; Bitter,Liver; Heart,leafy stem,To dispel wind and remove obstruction from the channels and to remove heat from blood and cause subsidence of swelling.,"Wind-damp impediment pain, hypertonicity of sinews and vessels, aching in lumbus and knees, throat impediment, swollen welling abscess, knocks and falls.",NA,Wind-Dampnessdispelling And Heatclearing Medicinal,祛风湿清热药,HERB003600,261,NA,NA,NA,NA,NA,NA,NA,NA,NA,NA
H00557,Alhagi pseudalhagi,Manaplant Alhagi Sweet Secretion,LUO TUO CI,骆驼刺,NA,NA,sweet secretion,"To clear heat and resolve toxin, disperse swelling and relieve pain.","Steaming bone vexation thirst, blood dysentery, diarrhea, abdominal pain, headache.",NA,NA,NA,HERB003602,NA,NPO31037,47037,Eukaryota,Viridiplantae,Streptophyta,Magnoliopsida,Fabales,Fabaceae,Alhagi,NA
H00558,NA,Spirulina major Kuetz.,LUO XUAN ZAO,螺旋藻,NA,NA,NA,NA,NA,NA,NA,NA,HERB003610,NA,NA,NA,NA,NA,NA,NA,NA,NA,NA,NA
H00559,Hypericum laricifolium,Larch-leaf StJohn’swort,LUO YE SONG YE JIN SI TAO,落叶松也金丝桃,NA,NA,NA,NA,NA,NA,NA,NA,HERB003613,NA,NPO16857,1136989,Eukaryota,Viridiplantae,Streptophyta,Magnoliopsida,Malpighiales,Hypericaceae,Hypericum,NA
H00560,Herba Humuli Scandentis,all-grass of japanese hop,LV CAO,葎草,NA,NA,root,1. Diurectic. 2. Bacteriostatic. Flower and fruit inhibit the growth of Bacillus tuberculosis and its alcoholic infusion of stemsand leaves inhibits that of gram-positive bacteria in vitro. ,"Tuberculosis, cystitis, mastitis, tonsillitis, lung heat cough, pulmonary welling abscess, vacuity heat with vexation and thirst, heat strangury, edema, inhibited urination, damp-heat diarrhea dysentery, heat toxin sores, itchy skin.",NA,Antipyretic Detoxicate Drugs,清热解毒药,HERB003616,263,NA,NA,NA,NA,NA,NA,NA,NA,NA,NA
H00563,herba meconpsis integrifoliae,all-grass of entire meconopsis,LV RONG HAO,绿绒蒿,Minor Warm; Bitter; Punkery,Liver; Kidney,Meconopsis integrifolia (Maxim.)Franch,NA,NA,NA,NA,NA,HERB003623,NA,NPO19361,248839,Eukaryota,Viridiplantae,Streptophyta,Magnoliopsida,Ranunculales,Papaveraceae,Meconopsis,NA
H00564,Herba Verbae,European Verbe Herb,MA BIAN CAO,马鞭草,NA,NA,aerial parts,"To promote the flow of blood and to relieve blood stasis, to stop malarial attacks, to counteract toxicity, and to cause diuresis.","Malaria, amenorrhea and dysmenorrhea, throat impediment, edema, heat strangury, diphtheria, bilharziosis, dysentery, concretion conglomeration accumulation and gathering.",NA,Blood Activating Stasis Removing Drugs,活血祛瘀药,HERB003636,266,NA,NA,NA,NA,NA,NA,NA,NA,NA,NA
H00565,Herba Portulacae,all-grass of Purslane,MA CHI XIAN,马齿苋,Cold; Sour,Large Intestine; Liver,aerial parts,"To remove toxic heat, and to arrest bleeding.","Heat toxin blood dysentery, acute bacillary dysentery, pertussis, enteritis, appendicitis, swollen welling abscess and clove sores, eczema, erysipelas, bleeding, postpartum bleeding, hematochezia, bleeding from hemorrhoids, flooding and spotting, ascariasis, ancylostomiasis, snake or insect bites.",NA,Antipyretic Detoxicate Drugs,清热解毒药,HERB003641,268,NA,3582,Eukaryota,Viridiplantae,Streptophyta,Magnoliopsida,Caryophyllales,Portulacaceae,No Rank at Level Genus,The herb belongs to a list of traditional Chinese medicines published by China's National Health Commission as both food and medicine
H00566,Cannabis sativa,Hemp Fimble Flower,MA HUA,麻花,NA,NA,male-flower,"To dispel wind, quicken blood, engender hairs.","Numbness in limbs, itchy body, shedding of eyebrow and hair, amenorrhea.",NA,NA,NA,HERB003656,NA,NPO7513,3483,Eukaryota,Viridiplantae,Streptophyta,Magnoliopsida,Rosales,Cannabaceae,Cannabis,NA
H00567,Herba Ephedrae,Ephedra,MA HUANG,麻黄,Warm; Pungent; Slightly Bitter,Lung; Bladder,herbaceous twigs,"To induce perspiration for dispelling cold, to relieve asthma, and to cause diuresis.","Wind-cold exterior repletion syndrome, headache without sweating, headache and generalized pain, cough, fever, fever and aversion to wind, absence of sweating, congesting lung, non-diffusion of lung qi, cough and asthma, bronchial asthma, wind water edema, nasal congestion, allergic rhinitis, inhibited urination, wind-damp impediment pain, muscle numbness, wind papule itching, yin flat abscess and phlegm node.",NA,Pungent-Warm Exterior-Releasing Medicinal,辛温解表药,HERB003658,264,NA,3387,Eukaryota,Viridiplantae,Streptophyta,Gnetopsida,Ephedrales,Ephedraceae,No Rank at Level Genus,NA
H00568,Radix Ephedrae,Ephedra Root,MA HUANG GEN,麻黄根,Mild; Sweet,Lung,root,To arrest perspiration.,Spontaneous sweating and night sweating.,NA,Astringent Medicinal,收涩药,HERB003659,265,NA,3387,Eukaryota,Viridiplantae,Streptophyta,Gnetopsida,Ephedrales,Ephedraceae,No Rank at Level Genus,NA
H00569,Bauhinia malabarica,Malaba Bauhinia,MA LA BA YANG TI JIA,NA,NA,NA,NA,NA,NA,NA,NA,NA,HERB003662,NA,NPO33638,1288007,Eukaryota,Viridiplantae,Streptophyta,Magnoliopsida,Fabales,Fabaceae,Piliostigma,NA
H00570,Semen Strychni,Nux Vomica,MA QIAN ZI,马钱子,Cold; Bitter,Spleen; Liver,seed,"To promote the flow of qi and blood in the collaterals, relieve pain, and promote the subsidence of swelling.","Hemiplegia, numbness and paralysis, muscle weakness, impotence, hypertrophic spinitis, chronic anemia, wind-damp intractable impediment, sequel of poliomyelitis, rheumatoid arthritis, knocks and falls, swelling pain of welling abscess and flat abscess.",Extremely Toxic,Wind-Dampnessdispelling And Colddispersing Medicinal,祛风湿散寒药,HERB003679,270,NA,NA,NA,NA,NA,NA,NA,NA,NA,NA
H00571,Aloe marlothii,Marloth Aloe,MA SHI LU HUI,马氏芦荟,NA,NA,NA,NA,NA,NA,NA,NA,HERB003689,NA,NPO15187,992641,Eukaryota,Viridiplantae,Streptophyta,Magnoliopsida,Asparagales,Asphodelaceae,Aloe,NA
H00572,Radix et Rhizoma Thalictri,root and rhizome of Manyleaf Meadowrue,MA WEI LIAN,马尾莲,NA,NA,NA,NA,"Influenza, fever in children, common cold with fever, measles papules, malaria, damp-heat diarrhea dysentery, jaundice, red eyes with gall.",NA,Heat-Clearing And Dampnessdrying Medicinal,清热燥湿药,HERB003698,271,NA,NA,NA,NA,NA,NA,NA,NA,NA,NA
H00573,Rhododendron ovatum,Ovateleaf Rhodode ndron,MA YIN HUA,马银花,NA,NA,root,"To clear damp heat, resolve sore toxin.","Damp-heat vaginal discharge, swollen welling abscess and clove sores.",NA,NA,NA,HERB003703,NA,NPO27773,49169,Eukaryota,Viridiplantae,Streptophyta,Magnoliopsida,Ericales,Ericaceae,Rhododendron,NA
H00574,Fructus Hordei Germitus,Germited Barley,MAI YA,麦芽,Mild; Sweet,Spleen; Stomach; Liver,germinated fruit,"To invigo rate the function of the spleen, to regulate the function of the stomach, and to promote the flow of milk.","Food accumulation, abdominal distention and diarrhea, nausea and vomiting, inappetence, galactostasis, distending pain in breast.",NA,Digestants,消食药,HERB003715,272,NA,NA,NA,NA,NA,NA,NA,NA,NA,The herb belongs to a list of traditional Chinese medicines published by China's National Health Commission as both food and medicine
H00575,Fructus Viticis,Shrub Chastetree Fruit,MAN JING ZI,蔓荆子,Minor cold; Pungent; Bitter,Bladder; Stomach; Liver,seed,To dispel wind-heat from the head and eyes.,"Externally contracted wind-heat, dizziness and headache, migraine, gum swelling and pain, red eyes with gall, delacrimation, wind-damp impediment pain, hypertonicity of limbs.",NA,Pungent Cool Diaphoretics,辛凉解表药,HERB003725,274,NA,1482179,Eukaryota,Metazoa,Arthropoda,Insecta,Coleoptera,Curculionidae,No Rank at Level Genus,NA
H00576,Folium Rhododendri Daurici,Dahurian Rhododendron Leaf,MAN SHAN HONG,满山红,Warm; Pungent; Bitter,Lung,leaf,NA,"Acute bronchitis, chronic bronchitis.",NA,Antitussive Antiasthmetics,止咳平喘药,HERB003730,273,NA,NA,NA,NA,NA,NA,NA,NA,NA,NA
H00577,Flemingia philippinensis [Syn. Moghania philippinensis],Philippine Flemingia,MAN XING QIAN JIN BA,蔓性千斤拔,NA,NA,root,"To dispel wind and eliminate damp, strengthen sinews and bones, quicken blood and resolve toxin.","Wind-damp impediment pain, taxation damage in lumbar muscle, wilting-weakness in limbs, knocks and falls, swelling pain in throat.",NA,NA,NA,HERB003738,NA,NPO4010,634991,Eukaryota,Viridiplantae,Streptophyta,Magnoliopsida,Fabales,Fabaceae,Flemingia,NA
H00578,Mangifera indica,Mango Equivalent plant: Mangifera persiciformis,MANG GUO,杧果,NA,NA,fruit,"To boost stomach, engender liquid, check vomiting, relieve cough.","Thirst, vomiting, reduced food intake, cough.",NA,NA,NA,HERB003740,NA,NPO29314,29780,Eukaryota,Viridiplantae,Streptophyta,Magnoliopsida,Sapindales,Anacardiaceae,Mangifera,NA
H00579,NA,Semen Mangiferae indica,MANG GUO HE,杧果核,NA,NA,NA,NA,NA,NA,NA,NA,HERB003741,NA,NA,NA,NA,NA,NA,NA,NA,NA,NA,NA
H00580,Erodium stephanianum,Common Heron’s Bill,MANG NIU ER MIAO,牻牛儿苗,NA,NA,aerial parts,See Geranium wilfordii.,See Geranium wilfordii.,NA,NA,NA,HERB003745,NA,NPO18313,337405,Eukaryota,Viridiplantae,Streptophyta,Magnoliopsida,Geraniales,Geraniaceae,Erodium,NA
H00581,Populus tomentosa,Chinese White Poplar,MAO BAI YANG,毛白杨,NA,NA,bark or twig,"To clear heat and disinhibit damp, relieve cough and transform phlegm.","Hepatitis, dysentery, strangury-turbidity, cough of phlegm asthma.",NA,NA,NA,HERB003750,NA,NPO19792,118781,Eukaryota,Viridiplantae,Streptophyta,Magnoliopsida,Malpighiales,Salicaceae,Populus,NA
H00582,Caragana tibetica,Tibet Peasshrub,MAO CI JIN JI ER,毛刺锦鸡儿,NA,NA,NA,NA,NA,NA,NA,NA,HERB003754,NA,NPO17706,390503,Eukaryota,Viridiplantae,Streptophyta,Magnoliopsida,Fabales,Fabaceae,Caragana,NA
H00583,Digitalis purpurea,Common Foxglove Equivalent plant: Digitalis lanata,MAO DI HUANG,毛地黄,NA,NA,leaf,To strengthen heart and disinhibit urine.,"Cardiac failure, edema due to heart disease.",NA,NA,NA,HERB003757,NA,NPO4443,4164,Eukaryota,Viridiplantae,Streptophyta,Magnoliopsida,Lamiales,Plantaginaceae,Digitalis,NA
H00584,Ilex pubescens,Pubescent Holly Equivalent plant: Ilex pubescens var glaber,MAO DONG QING,毛冬青,NA,NA,root,"To clear heat and resolve toxin, quicken blood and free network vessels.","Angina pectoris, acute myocardial infarction, cerebral thrombosis, thrombophlebitis, thromboangiitis obliterans (Buerger’s disease), central retinitis, central angiospastic retinitis, wind-heat common cold, lung heat cough asthma, sore pharynx, nipple moth, gum swelling and pain, chest impediment and heart pain, wind stroke with hemiplegia, erysipelas, burns and scalds, welling abscess and flat abscess.",NA,Blood activation and stasis removal,活血化淤,HERB003760,NA,NPO14547,185543,Eukaryota,Viridiplantae,Streptophyta,Magnoliopsida,Aquifoliales,Aquifoliaceae,Ilex,NA
H00585,Drosera peltata var. lunata,Lunate Peltate Sundew,MAO GAO CAI,茅膏菜,NA,NA,whole herb,"To dispel wind and relieve pain, quicken blood, resolve toxin.","Wind-damp impediment pain, knocks and falls, taxation damage in lumbar muscle, stomachache, common cold, swelling pain in throat, red and white dysentery, malaria, child gan accumulation, eye screen, scrofula, eczema, scab sore.",NA,NA,NA,HERB003765,NA,NPO22736.1,4369,Eukaryota,Viridiplantae,Streptophyta,Magnoliopsida,Caryophyllales,Droseraceae,Drosera,NA
H00586,Rhododendron seniavinii,Hairfruit Rhododendron,MAO GUO DU JUAN,毛果杜鹃,NA,NA,"root, stem-leaf and flower","To relieve cough, dispel phlegm, calm asthma.",Chronic trachitis.,NA,NA,NA,HERB003773,NA,NA,1048537,Eukaryota,Viridiplantae,Streptophyta,Magnoliopsida,Ericales,Ericaceae,Rhododendron,NA
H00587,Isodon trichocarpa,Hairyfruit Rabdosia,MAO GUO XIANG CHA CAI,毛果香茶菜,NA,NA,NA,NA,NA,NA,NA,NA,HERB003780,NA,NPO8333,NA,NA,NA,NA,NA,NA,NA,NA,NA
H00588,Actinidia eriantha,Hairyflower Actinidia,MAO HUA MI HOU TAO,毛花猕猴桃,NA,NA,root and root cortex,"To resolve toxin and disperse swelling, clear heat and disinhibit damp.","Heat toxin swollen welling abscess, mammary welling abscess, aphonia due to lung heat, damp-heat dysentery, strangury-turbidity and vaginal discharge, wind-damp impediment pain, carcinoma of stomach, carcinoma of esophagus, mastocarcinoma, knocks and falls.",NA,NA,NA,HERB003790,NA,NPO6857,165200,Eukaryota,Viridiplantae,Streptophyta,Magnoliopsida,Ericales,Actinidiaceae,Actinidia,NA
H00589,NA,NA,MAO MAI WU ZHU YU,毛脉吴茱萸,NA,NA,NA,NA,NA,NA,NA,NA,HERB003800,NA,NA,NA,NA,NA,NA,NA,NA,NA,NA,NA
H00590,Datura innoxia,Hairy Datura Leaf,MAO MAN TUO LUO YE,毛曼陀罗叶,NA,NA,leaf,See Datura metel.,See Datura metel.,NA,NA,NA,HERB003803,NA,NPO29740,4075,Eukaryota,Viridiplantae,Streptophyta,Magnoliopsida,Solanales,Solanaceae,Datura,NA
H00591,Clerodendranthus spicatus,Spicate Clerodendranthus,MAO XU CAO,猫须草,NA,NA,whole herb,"To clear heat and dispel damp, expel stone and disinhibit water.","Acute nephritis, chronic nephritis, cystitis, urethral stone, rheumatic arthritis.",NA,NA,NA,HERB003820,NA,NPO18655,516067,Eukaryota,Viridiplantae,Streptophyta,Magnoliopsida,Lamiales,Lamiaceae,Clerodendranthus,NA
H00592,Veratrum grandiflorum,Largeflower Falsehellebore,MAO YE LI LU,毛叶藜芦,NA,NA,root and rhizome,See Veratrum nigrum.,See Veratrum nigrum.,NA,NA,NA,HERB003826,NA,NPO4897,203092,Eukaryota,Viridiplantae,Streptophyta,Magnoliopsida,Liliales,Melanthiaceae,Veratrum,NA
H00593,Rabdosia japonica,Japanese Rabdosia,MAO YE XIANG CHA CAI,毛叶香茶菜,NA,NA,leaf,"To clear heat and resolve toxin, quicken blood and disperse swelling.","Hepatitis, gastritis, mastitis, amenorrhea, knocks and falls, pain in joints, snake or insect bites.",NA,NA,NA,HERB003830,NA,NPO16019.1,425908,Eukaryota,Viridiplantae,Streptophyta,Magnoliopsida,Lamiales,Lamiaceae,Isodon,NA
H00594,Radix Ranunculi Terti,Catclaw Buttercup Root,MAO ZHUA CAO,猫爪草,Warm; Pungent; Sweet,Lung; Liver,NA,To dissolve lumps and cause subsidence of swelling.,Treament of tuberculosis of lymph nodes without ulceration.,NA,Antipyretic Detoxicate Drugs,清热解毒药,HERB003837,276,NA,NA,NA,NA,NA,NA,NA,NA,NA,NA
H00595,Corydalis rosea,Rose Corydalis,MEI GUI HONG JIN,玫瑰红景天,NA,NA,NA,NA,NA,NA,NA,NA,HERB003839,NA,NPO25365,NA,NA,NA,NA,NA,NA,NA,NA,NA
H00596,Flos Rosae Rugosae,Rose Flower,MEI GUI HUA,玫瑰花,Warm; Sweet; Slightly Bitter,Spleen; Liver,bud,"To relieve stagnation of qi, regulate blood circulation, and to arrest pain.","Liver stomach qi pain, reduced food intake with nausea and vomiting, menstrual disorder, painful wound from knocks and falls.",NA,Qi Regulating Drugs,理气药,HERB003840,278,NA,NA,NA,NA,NA,NA,NA,NA,NA,The herb belongs to a list of traditional Chinese medicines published by China's National Health Commission as both food and medicine
