FHDI_Herb_ID,Herb_Latin_Name,Herb_English_Name,Herb_Pinyin_Name,Herb_Chinese_Name,Properties,Meridians ,Use_Part,Function ,Indication,Toxicity ,Therapeutic_Class,Therapeutic _Class_Chinese,HERB_ID,SymMap_ID,NPASS_ID,Taxonomy_ID,Superkingdom,Kingdom,Phylum,Class,Order,Family,Genus,Drug homologous food
H00802,Cola acuminata,Acuminate Colanut,SU DAN KE LE GUO,苏丹可乐果,NA,NA,seed,To raise spirit.,NA,NA,NA,NA,HERB005279,NA,NPO26505,93760,Eukaryota,Viridiplantae,Streptophyta,Magnoliopsida,Malvales,Malvaceae,Cola,NA
H00803,Styrax,Storax,SU HE XIANG,苏合香,Warm; Pungent,Spleen; Heart,balsam from trunk,1. To open the orifices and clear the mind; 2. To stop pain,"Wind stroke with phlegm reversal, sudden clouding collapse, cold pain in chest and abdomen, fright epilepsy, warm disease.",NA,Resuscitative Stimulant; Resuscitative Medicinal,开窍药,HERB005287,385,NA,13699,Eukaryota,Viridiplantae,Streptophyta,Magnoliopsida,Ericales,Styracaceae,No Rank at Level Genus,NA
H00804,Caesalpinia sappan,Sappan Caesalpinia,SU MU,苏木,Mild; Pungent; Sweet; Salty,Spleen; Liver; Heart,heartwood,"To quicken blood and dispel stasis, disperse swelling and relieve pain.","Amenorrhea and dysmenorrhea, postpartum blood stasis, stabbing pain in chest and abdomen, swelling pain due to external injury.",NA,Blood activation and stasis removal,活血化淤,HERB005297,NA,NPO29935,483143,Eukaryota,Viridiplantae,Streptophyta,Magnoliopsida,Fabales,Fabaceae,Biancaea,NA
H00805,Tamarindus indica,Tamarind Fruit,SUAN JIAO,酸角,NA,NA,fruit,"To clear heat and resolve toxin, harmonize stomach and disperse accumulation.","Summerheat stroke, inappetence, child gan accumulation, vomiting in pregnancy, constipation.",NA,NA,NA,HERB005311,NA,NPO24492,58860,Eukaryota,Viridiplantae,Streptophyta,Magnoliopsida,Fabales,Fabaceae,Tamarindus,NA
H00806,Rumex acetosa,Garden Sorrel,SUAN MO,酸模,NA,NA,root,"To cool blood and stanch bleeding, drain heat and free stool, disinhibit urine, kill worms.","Blood ejection, hematochezia, profuse menstruation, heat dysentery, red eyes, constipation, urinary stoppage, strangury-turbidity, malign sore, scab and lichen, eczema.",NA,NA,NA,HERB005312,NA,NPO13418,41241,Eukaryota,Viridiplantae,Streptophyta,Magnoliopsida,Caryophyllales,Polygonaceae,Rumex,NA
H00807,Ziziphus jujuba var. spinosa,Spine Date,SUAN ZAO,酸枣,NA,NA,seed,"To quiet heart and spirit, nourish liver, constrain sweat.","Vacuity vexation and egersis, fright palpitation and fearful throbbing, spontaneous sweating and night sweating due to vacuity.",NA,NA,NA,HERB005318,NA,NPO5986.2,714518,Eukaryota,Viridiplantae,Streptophyta,Magnoliopsida,Rosales,Rhamnaceae,Ziziphus,The herb belongs to a list of traditional Chinese medicines published by China's National Health Commission as both food and medicine
H00808,Semen Aesculi,Buckeye Seed,SUO LUO ZI,娑罗子,NA,NA,ripe fruit without shell,"To regulate the flow of qi, normalize the stomach function and relieve pain.","Distending pain in chest and rib-side, distending pain in breast, dysmenorrhea, pain in stomach duct, pain in chest and abdomen.",NA,Qi Regulating Drugs,理气药,HERB005335,387,NA,NA,NA,NA,NA,NA,NA,NA,NA,NA
H00809,Cephalotaxus wilsoniana,Wilson Plumyew,TAI WAN CU FEI,台湾粗榧,NA,NA,NA,NA,NA,NA,NA,NA,HERB005359,NA,NPO40472,50179,Eukaryota,Viridiplantae,Streptophyta,Pinopsida,Cupressales,Taxaceae,Cephalotaxus,NA
H00810,Hibiscus taiwanensis,Taiwan Hibiscus,TAI WAN FU RONG,台湾芙蓉,NA,NA,root and stem,"To clear lung and relieve cough, cool blood and resolve toxin.","Lung heat cough, toxin swelling of sores.",NA,NA,NA,HERB005362,NA,NPO5895,1898877,Eukaryota,Viridiplantae,Streptophyta,Magnoliopsida,Malvales,Malvaceae,Hibiscus,NA
H00811,Goniothalamus amuyon,Ｔaiwan Goniothalamus,TAI WAN GE NA XIANG,台湾哥纳香,NA,NA,NA,NA,NA,NA,NA,NA,HERB005363,NA,NPO15866,1602035,Eukaryota,Viridiplantae,Streptophyta,Magnoliopsida,Magnoliales,Annonaceae,Goniothalamus,NA
H00812,Ajuga taiwanensis,Taiwan Bugle,TAI WAN JIN GU CAO,台湾筋骨草,NA,NA,NA,NA,NA,NA,NA,NA,HERB005369,NA,NPO7849,946572,Eukaryota,Viridiplantae,Streptophyta,Magnoliopsida,Lamiales,Lamiaceae,Ajuga,NA
H00813,Taraxacum formosanum,Taiwan Dandelion,TAI WAN PU GONG YING,台湾蒲公英,NA,NA,NA,NA,NA,NA,NA,NA,HERB005375,NA,NPO9194,170733,Eukaryota,Viridiplantae,Streptophyta,Magnoliopsida,Asterales,Asteraceae,Taraxacum,NA
H00814,Radix Pseudostellariae,Heterophylly Falsestarwort Root,TAI ZI SHEN,太子参,Mild; Sweet; Slightly Bitter,Lung; Spleen,NA,"To replenish qi and invigorate the spleen function, and topromote fluid secretion and moisten the lung.","Treatment of hypofunction of the spleen with lassitude and anorexia, debility and deficiency of qi and yin marked by spontaneous sweating and thirst during convalescence dry cough due to dryness of the lung.",NA,Qi Reinforcing Drugs,补气药,HERB005390,388,NPO24062,2057904,Eukaryota,No Rank at Level Kingdom,Oomycota,No Rank at Level Class,Peronosporales,Peronosporaceae,Peronospora,NA
H00815,Lignum Santaii Albi,Sandalwood,TAN XIANG,檀香,Warm; Pungent,Spleen; Stomach; Kidney,heartwood,"To promote the flow of qi in the heart, to warm the spleen and stomach, to increse appetite, and to relieve pain.","Pain in chest and abdomen, cold stomachache, vomiting of water due to congealing cold qi stagnation, coronary heart disease with pattern of qi stagnation and blood stasis.",NA,Qi Regulating Drugs,理气药,HERB005392,389,NA,NA,NA,NA,NA,NA,NA,NA,NA,NA
H00816,Prunus persica,Peach Root,TAO GEN,桃根,NA,NA,root,"To clear heat and disinhibit damp, quicken blood and relieve pain, disperse swollen welling abscess.","Jaundice, sand qi abdominal pain, lumbago, taxation damage due to knocks and falls, wind-damp impediment pain, amenorrhea, blood ejection, spontaneous external bleeding, swollen welling abscess, hemorrhoids.",NA,NA,NA,HERB005405,NA,NPO14992,3760,Eukaryota,Viridiplantae,Streptophyta,Magnoliopsida,Rosales,Rosaceae,Prunus,NA
H00817,Prunus persica,Peach Flower Equivalent plant: SHAN TAO HUA,TAO HUA,桃花,NA,NA,flower,"To disinhibit water and free stool, quicken blood and transform stasis.","Inhibited urination, edema, phlegm-rheum, sand strangury, stone strangury, beriberi, constipation, concretion and conglomeration, amenorrhea, mania and withdrawal, sore and papules.",NA,NA,NA,HERB005406,NA,NPO14992,3760,Eukaryota,Viridiplantae,Streptophyta,Magnoliopsida,Rosales,Rosaceae,Prunus,NA
H00818,Rhodomyrtus tomentosa,Rosemyrtle,TAO JIN NIANG,桃金娘,NA,NA,fruit,"To nourish blood and stanch bleeding, astringe intestines and secure essence.","Blood vacuity and general weakness, blood ejection, nosebleed(epistaxis), taxation damage hemoptysis, hematochezia, flooding and spotting, emission, vaginal discharge, dysentery, prolapse of rectum, scalds, bleeding due to external injury.",NA,NA,NA,HERB005409,NA,NPO13106,98583,Eukaryota,Viridiplantae,Streptophyta,Magnoliopsida,Myrtales,Myrtaceae,Rhodomyrtus,NA
H00819,Prunus persica,Peach Bast Equivalent plant: Prunus davidiana,TAO JING BAI PI,桃茎白皮,NA,NA,bast,"To clear heat and disinhibit damp, resolve toxin, kill worms.","Edema, sand qi abdominal pain, lung heat asthma and oppression, welling abscess and flat abscess, scrofula, damp sore.",NA,NA,NA,HERB005410,NA,NPO14992,3760,Eukaryota,Viridiplantae,Streptophyta,Magnoliopsida,Rosales,Rosaceae,Prunus,NA
H00820,Semen Persicae,Peach Seed,TAO REN,桃仁,Mild; Sweet; Bitter,Large Intestine; Liver; Heart,seed,"To promote blood circulation, to eliminate phlegm, and to relax the bowels.","Amenorrhea, dysmenorrhea, concretion and conglomeration, lump glomus, knocks and falls, intestinal dry and constipation.",Slightly Toxic,Blood Activating Stasis Removing Drugs,活血祛瘀药,HERB005412,390,NA,3760,Eukaryota,Viridiplantae,Streptophyta,Magnoliopsida,Rosales,Rosaceae,Prunus,"Peach Seed, a traditional Chinese medicine name. Dried mature seeds of the Rosaceae plant Prunus persica (L.) Batsch or Prunus davidiana (Carr.) Franch. After the fruit ripens, harvest it, remove the flesh and shell, remove the seeds, and dry them in the sun."
H00821,Prunus persica,Peach Leaf,TAO YE,桃叶,NA,NA,leaf,"To dispel wind and clear heat, dry damp and resolve toxin, kill worms.","Externally contracted wind evil, head wind, headache, wind impediment, eczema, swollen welling abscess and sores, lichen sore, malaria, trichomoniasis.",NA,NA,NA,HERB005413,NA,NPO14992,3760,Eukaryota,Viridiplantae,Streptophyta,Magnoliopsida,Rosales,Rosaceae,Prunus,NA
H00822,Prunus persica,Peach Juvenile Branch Equivalent plant: Prunus davidiana,TAO ZHI,桃枝,NA,NA,branchlet,"To quicken blood and free network vessels, resolve toxin, kill worms.","Pain in heart and abdomen, invisible worm sores.",NA,NA,NA,HERB005415,NA,NPO14992,3760,Eukaryota,Viridiplantae,Streptophyta,Magnoliopsida,Rosales,Rosaceae,Prunus,NA
H00823,Garcinia morella,Gamboge Tree Resin,TENG HUANG,藤黄,NA,NA,balsam,"To disperse swelling and resolve toxin, stanch bleeding and kill worms.","Swelling toxin of welling abscess and flat abscess, intractable lichen, malign sore, bleeding due to external injury, gan of teeth and gum, burns and scalds.",NA,"For eliminating toxic materials, dissolving rottenness and growing new muscles",拔毒化腐生肌,HERB005421,NA,NPO3806,1585849,Eukaryota,Viridiplantae,Streptophyta,Magnoliopsida,Malpighiales,Clusiaceae,Garcinia,NA
H00824,Garcinia cambogia,Camboge Garcinia,TENG HUANG SHAN ZHU ZI,腾黄山竹子,NA,NA,NA,NA,NA,NA,NA,NA,HERB005422,NA,NPO11266,1220707,Eukaryota,Viridiplantae,Streptophyta,Magnoliopsida,Malpighiales,Clusiaceae,Garcinia,NA
H00825,Radix Asparagi,Cochinchinese Asparagus Root,TIAN DONG,天冬,Cold; Sweet; Bitter,Lung; Kidney,NA,"To replenish yin, promote fluid secretion and moisten the lung.","1. Asparamide is an expectorant, antitussive and antiasthmatic.2. Inhibiting the cell growth of acute lymphocytic, acute monocytic and chronic granulocytic leukemias in vitro.",NA,Yin-Tonifying Medicinal,补阴药,HERB005434,391,NA,NA,NA,NA,NA,NA,NA,NA,NA,NA
H00826,Semen Cucumis,muskmelon seed,TIAN GUA ZI,甜瓜子,Cold; Bitter,Liver; Heart,NA,NA,NA,NA,Phlegresolving Medicine,化痰药,HERB005442,399,NA,3655,Eukaryota,Viridiplantae,Streptophyta,Magnoliopsida,Cucurbitales,Cucurbitaceae,No Rank at Level Genus,NA
H00827,Radix Semiaquilegiae,Muskroot-like Semiaquilegia Root,TIAN KUI ZI,天葵子,Cold; Sweet; Bitter,Stomach; Liver,NA,To remove toxic heat and promote the subsidence of swelling.,"Treatment of carbuncles, boils and sores, mastitis, scrofula, venomous snake bite.",NA,Antipyretic Detoxicate Drugs,清热解毒药,HERB005447,393,NPO25746,349365,Eukaryota,Viridiplantae,Streptophyta,Magnoliopsida,Ranunculales,Ranunculaceae,No Rank at Level Genus,NA
H00828,Gastrodia elata,Tall Gastrodia,TIAN MA,天麻,Mild; Sweet,Liver,stem and tuber,"To extinguish wind and check tetany, calm liver and subdue yang , dispel wind and free network vessels.","Convulsion, child convulsion, spasm in limbs, facial muscle spasm, trigeminal neuralgia, numbness in limbs, acute fright wind, chronic fright wind, tetanus, dizziness, headache, hemiplegia, hypertension, wind-damp impediment pain.",NA,For calming liver and containing wind,平肝息风,HERB005451,NA,NPO22309,91201,Eukaryota,Viridiplantae,Streptophyta,Magnoliopsida,Asparagales,Orchidaceae,Gastrodia,NA
H00829,Asparagus cochinchinensis [Syn. Asparagus lucidus ],Cochinchinese Asparagus,TIAN MEN DONG,天门冬,Sweet;  bitter; Extremely cold,Lung; kidney,tuberoid,"To enrich yin and moisten dryness, clear lung and downbear fire.","Yin vacuity fever, cough with blood ejection, lung wilting, pulmonary welling abscess, swelling pain in throat, diabetes mellitus, constipation.",NA,For tonifying weakness,补虚,HERB005452,NA,NPO11694,100514,Eukaryota,Viridiplantae,Streptophyta,Magnoliopsida,Asparagales,Asparagaceae,Asparagus,NA
H00830,Rheum wittrocki,Tianshan Mountain Rhubarb,TIAN SHAN DA HUANG,天山大黄,NA,NA,NA,NA,NA,NA,NA,NA,HERB005466,NA,NPO18339,137228,Eukaryota,Viridiplantae,Streptophyta,Magnoliopsida,Caryophyllales,Polygonaceae,Rheum,NA
H00831,Garcinia dulcis,Dulcin Garcinia,TIAN SHAN ZHU ZI,天山竹子,NA,NA,NA,NA,NA,NA,NA,NA,HERB005472,NA,NPO22337,231905,Eukaryota,Viridiplantae,Streptophyta,Magnoliopsida,Malpighiales,Clusiaceae,Garcinia,NA
H00832,Concretio Silicea Bambusae,Chinese schinzostachyum Tabasheer,TIAN ZHU HUANG,天竺黄,Cold; Sweet,Liver; Heart; Gallbladder,NA,For desolving phlegm,NA,NA,Phlegresolving Medicine,化痰药,HERB005485,398,NPO6456,NA,NA,NA,NA,NA,NA,NA,NA,NA
H00833,Radix Smilacis,root and rhizome of smilax,TIE SI WEI LING XIAN,铁丝威灵仙,Warm; Pungent; Salty,NA,NA,NA,NA,NA,Wind-Dampnessdispelling And Heatclearing Medicinal,祛风湿清热药,HERB005508,400,NPO15634,NA,NA,NA,NA,NA,NA,NA,NA,NA
H00834,Herba Acalyphae,Copperleaf Herb,TIE XIAN CAI,铁苋菜,NA,NA,Acalypha austrahs L.,"1. Treatment of diarrhea and dysentery of darnpness-heat type. Recently, also for amebic dysentery and typhoid fever. 2. Treatment of hemoptysis, hematemesis, hemafecia, metrorrhagia, etc. 3. Treatment of dyspneic cough of lung-heat type.",1. Bacteriostatic. 2. Astringent and protective on intestinal mucosa. 3. Antiasthmatic.,NA,Heat clearence,清热,HERB005509,NA,NPO18030,235880,Eukaryota,Viridiplantae,Streptophyta,Magnoliopsida,Malpighiales,Euphorbiaceae,No Rank at Level Genus,"Copperleaf Herb has the effects of clearing heat and dampness, cooling blood and detoxifying, and reducing accumulation. Modern research has shown that iron amaranth has antibacterial, anti-inflammatory, anti asthma, increased platelet count, and anti diarrhea effects."
H00835,Semen Lepiddi seu Descurainiae;Semen Lepidii；Semen Descurainiae,"Lepidium seed, Descurainia seed",TING LI ZI,葶苈子,Extreme Cold; Pungent; Bitter,Lung; Bladder,seed,"To quench fire in the lung, to relieve dyspnea, and to cause diuresis.","Phlegm-drool and congesting lung, cough and asthma with abundant phlegm, distention fullness in chest and rib-side, edema in chest and abdomen, inhibited urination.",NA,Antitussive Antiasthmetics,止咳平喘药,HERB005519,402,NPO6229,46091,Eukaryota,Viridiplantae,Streptophyta,Magnoliopsida,Caryophyllales,Chenopodiaceae,Chenopodiastrum,NA
H00836,Cinchona cuprea,Cupreous Cinchona,TONG SE JI NA SHU,铜金鸡纳,NA,NA,NA,NA,NA,NA,NA,NA,HERB005535,NA,NPO1400,NA,NA,NA,NA,NA,NA,NA,NA,NA
H00838,Rhizoma Smilacis Glabrae,Glabrous Greenbrier Rhizome,TU FU LING,土茯苓,Mild; Sweet; Neutral,Stomach; Liver,rhizome,"To remove damp, to counteract toxicity, and to improve the mobility of joints.","Damp-heat with strangury turbidity, vaginal discharge, swollen welling abscess, scrofula, scab and lichen, syphilis, mercurial poisoning.",NA,Antipyretic Detoxicate Drugs,清热解毒药,HERB005564,405,NA,NA,NA,NA,NA,NA,NA,NA,NA,NA
H00839,NA,Pseudolaricis Cortex,TU JING PI,土荆皮,NA,NA,NA,NA,"Scab and lichen, eczema, neurodermatitis .",NA,Medicinal For Detoxification、Parasiticide、Drying Dampness And Relieving Itching,解毒杀虫燥湿止痒药,HERB005569,406,NA,NA,NA,NA,NA,NA,NA,NA,NA,NA
H00840,Senecio chrysanthemoides,Chrusanthemum-like Groundsel,TU SAN QI,土三七,NA,NA,whole herb or root,"To clear heat and resolve toxin, dissipate stasis and disperse swelling.","Toxin swelling of sores, painful swelling from knocks and falls.",NA,NA,NA,HERB005578,NA,NA,189235,Eukaryota,Viridiplantae,Streptophyta,Magnoliopsida,Asterales,Asteraceae,Jacobaea,NA
H00841,Semen Cuseutae,Dodder Seed,TU SI ZI,菟丝子,Mild; Pungent; Sweet,Liver; Kidney,NA,"To arrest seminal discharge and abnormal urination, prevent abortion, improve eyesight and relieve diarrhea by replenishing and tonifying the liver and the kidney.",1. Cardiotonic. 2. Promoting lymphocyte-blastogenesis.,NA,Yang Reinforcing Drugs,补阳药,HERB005580,407,NA,292919,Eukaryota,Viridiplantae,Streptophyta,Magnoliopsida,Solanales,Convolvulaceae,No Rank at Level Genus,NA
H00842,Origanum vulgare,Common Origanum,TU XIANG RU,土香薷,NA,NA,whole herb,"To resolve exterior, rectify qi, clear summerheat, disinhibit damp.","Common cold with fever, summerheat stroke, distention fullness in chest and diaphragm, vomiting diarrhea with abdominal pain, jaundice, edema, vaginal discharge, child gan accumulation, measles papules, itchy skin, swelling pain of sores, knocks and falls.",NA,NA,NA,HERB005582,NA,NPO29169,39352,Eukaryota,Viridiplantae,Streptophyta,Magnoliopsida,Lamiales,Lamiaceae,Origanum,NA
H00843,Concha Arcae,Arc Shell,WA LENG ZI,瓦楞子,Salty; neutral,Lung;  stomach; liver,NA,"To eliminate phlegm, to remove blood stasis, to soften hard masses and dissolve lumps, and to relieve gastric pain by reducing acid.","Treatment of retention of sticky phlegm difficult to expectorate, goitre, scrofula, masses in the abdomen, gastric pain with acid regurgitation.",NA,Phlegresolving Medicine,化痰药,HERB005602,408,NPO23812,NA,NA,NA,NA,NA,NA,NA,NA,NA
H00844,Hypericum curvisepalum,Curvedsepal StJohn’swort,WAN E JIN SI TAO,贯叶金丝桃,NA,NA,NA,NA,NA,NA,NA,NA,HERB005615,NA,NA,1136967,Eukaryota,Viridiplantae,Streptophyta,Magnoliopsida,Malpighiales,Hypericaceae,Hypericum,NA
H00845,Herba Artemisiae,all-grass of Russian Wormwood,WAN NIAN HAO,万年蒿,Cold; Bitter,NA,Artemisia sacrorum Ledeb.,NA,NA,NA,NA,NA,HERB005618,NA,NA,4219,Eukaryota,Viridiplantae,Streptophyta,Magnoliopsida,Asterales,Asteraceae,No Rank at Level Genus,NA
H00846,Tagetes erecta,Aztec Marigold Leaf,WAN SHOU JU YE,万寿菊叶,NA,NA,leaf,To clear heat and resolve toxin.,"Innominate toxin swelling, gan disease, welling abscess, sore, clove sore.",NA,NA,NA,HERB005629,NA,NPO17962,13708,Eukaryota,Viridiplantae,Streptophyta,Magnoliopsida,Asterales,Asteraceae,Tagetes,NA
H00847,Semen Vaccariae,"Vacarria seed, Cow soapwort seed",WANG BU LIU XING,王不留行,Mild; Bitter,Stomach; Liver,seed,1. To invigorate blood and promote menstruation; 2. To promote lactation,"Galactostasis, amenorrhea, dysmenorrhea, mammary welling abscess.",NA,Blood Activating Stasis Removing Drugs,活血祛瘀药,HERB005637,410,NA,NA,NA,NA,NA,NA,NA,NA,NA,NA
H00848,Magnolia biondii,Biond Magnolia,WANG CHUN YU LAN,玉兰,NA,NA,flower bud,See Magnolia liliflora.,See Magnolia liliflora.,NA,NA,NA,HERB005638,NA,NPO18811,86725,Eukaryota,Viridiplantae,Streptophyta,Magnoliopsida,Magnoliales,Magnoliaceae,Magnolia,NA
H00849,Trichosanthes cucumeroides,Japanese Snakegourd,WANG GUA,王瓜,NA,NA,fruit,"To eliminate heat, engender liquid, dispel stasis, promote lactation.","Diabetes mellitus, jaundice, dysphagia-occlusion and stomach reflux, amenorrhea, scant breast milk, swollen welling abscess, chronic pharyngolaryngitis.",NA,NA,NA,HERB005640,NA,NPO21876,685054,Eukaryota,Viridiplantae,Streptophyta,Magnoliopsida,Cucurbitales,Cucurbitaceae,Trichosanthes,NA
H00850,Cassia occidentalis,Coffee Senna,WANG JIANG NAN,望江南,NA,NA,stem-leaf,"To clear lung, clear liver, calm asthma, disinhibit urine, free stool, resolve toxin and disperse swelling, lower blood pressure.","Cough and asthma, hypertension, headache and red eyes, dribbling urination, constipation, swelling toxin of welling abscess and sore, snake or insect bites.",NA,NA,NA,HERB005644,NA,NPO30179,126820,Eukaryota,Viridiplantae,Streptophyta,Magnoliopsida,Fabales,Fabaceae,Senna,NA
H00851,Herba Potentillae Chinensis,Chinese Cinquefoil,WEI LING CAI,委陵菜,NA,NA,whole herb with root,"To remove toxic heat and reduce heat in blood, and to relieve dysentery.","Red dysentery and abdominal pain, enduring dysentery, bleeding hemorrhoids, swelling toxin of sore and welling abscess.",NA,Antipyretic Detoxicate Drugs,清热解毒药,HERB005658,412,NA,210858,Eukaryota,Viridiplantae,Streptophyta,Magnoliopsida,Rosales,Rosaceae,Potentilla,Herba Potentillae Chinensis for treating colds and bronchial asthma
H00852,Radix Clematidis,Chinese Clematis Root,WEI LING XIAN,威灵仙,Warm; Pungent; Salty,Bladder,root,"To relieve rheumatic conditions, to remove obstruction of collaterals, and to alleviate pain.","Common cold, tonsillitis, acute icterohepatitis, laryngitis, rheumatic arthritis, wind-damp impediment pain, numbness in limbs, hypertonicity of sinews and vessels, bone stuck in throat.",NA,Wind-Dampnessdispelling And Colddispersing Medicinal,祛风湿散寒药,HERB005659,411,NA,1898614,Eukaryota,Fungi,Ascomycota,Dothideomycetes,Pleosporales,No Rank at Level Family,No Rank at Level Genus,NA
H00853,Rabdosia excisa,Taillikeleaf Rabdosia,WEI YE XIANG CHA CAI,尾叶香茶菜,NA,NA,NA,NA,NA,NA,NA,NA,HERB005672,NA,NPO17628,NA,NA,NA,NA,NA,NA,NA,NA,NA
H00854,Equisetum arvense,Bottle-brush,WEN JING,NA,NA,NA,aerial parts,"To stanch bleeding, disinhibit urine, brighten eyes.","Spontaneous external bleeding, blood ejection, hemoptysis, hematochezia, flooding and spotting, bleeding due to external injury, red eyes and eye screen.",NA,NA,NA,HERB005677,NA,NPO21528,3258,Eukaryota,Viridiplantae,Streptophyta,Polypodiopsida,Equisetales,Equisetaceae,Equisetum,NA
H00856,Diphylleia sinensis,Chinese Umbrellaleaf Equivalent plant: Diphylleia grayi,WO ER QI,窝儿七,NA,NA,rhizome,"To dispel wind-damp, clear heat and cool blood, quicken blood and relieve pain, drain precipitation.","Rheumatic arthritis, pain in lumbus and legs, steaming bone taxation fever, knocks and falls, menstrual disorder, painful bind in lesser-abdomen, swollen welling abscess.",NA,NA,NA,HERB005685,NA,NPO26868,382113,Eukaryota,Viridiplantae,Streptophyta,Magnoliopsida,Ranunculales,Berberidaceae,Diphylleia,NA
H00858,Ficus carica,Fig Leaf,WU HUA GUO YE,无花果叶,NA,NA,leaf,"To clear damp heat, resolve sore toxin, disperse swelling and relieve pain.","Damp-heat diarrhea, vaginal discharge, hemorrhoids, pain from swollen welling abscess, scrofula.",NA,NA,NA,HERB005711,NA,NPO22234,3494,Eukaryota,Viridiplantae,Streptophyta,Magnoliopsida,Rosales,Moraceae,Ficus,NA
H00859,NA,semen sapindi mukorossi,WU HUAN ZI SHU QIANG,无患子树蔃,NA,NA,NA,NA,NA,NA,NA,NA,HERB005714,NA,NA,NA,NA,NA,NA,NA,NA,NA,NA,NA
H00860,Sapindus mukorossi,Chinese Soapberry Leaf,WU HUAN ZI YE,无患子叶,NA,NA,branchlet-leaf,"To resolve toxin, suppress cough.","Snake bite, pertussis.",NA,NA,NA,HERB005715,NA,NPO957,57655,Eukaryota,Viridiplantae,Streptophyta,Magnoliopsida,Sapindales,Sapindaceae,Sapindus,NA
H00861,Gallus domesticus,Black Chicken,WU JI,乌鸡,Mild; Sweet,Liver; Kidney,NA,NA,NA,NA,NA,NA,HERB005716,NA,NPO30300,9031,Eukaryota,Metazoa,Chordata,Aves,Galliformes,Phasianidae,Gallus,NA
H00862,NA,Folium Acanthopanacis gracilistyti,WU JIA YE,五加叶,NA,NA,NA,NA,NA,NA,NA,NA,HERB005719,NA,NA,NA,NA,NA,NA,NA,NA,NA,NA,NA
H00863,Aquilegia ecalcarata,Spurless Columbine,WU JU LOU DOU CAI,无距耧斗菜,NA,NA,whole herb with root,"To resolve exterior and abate fever, draw out toxin and engender flesh.","Common cold with headache, putrefying sore, yellow-water sore.",NA,NA,NA,HERB005724,NA,NPO4004,46965,Eukaryota,Viridiplantae,Streptophyta,Magnoliopsida,Ranunculales,Ranunculaceae,Aquilegia,NA
H00864,Fructus Mume,Smoked Plum,WU MEI,乌梅,Mild; Sour,Lung; Spleen; Stomach; Liver,unripe fruit,"To arrest persistent cough, to relieve diarrhea by astringing the intestines, to promote the production of body fluid, and to relieve colic caused by ascaris.","Enduring cough, chronic diarrhea and dysentery, hematuria, hematochezia, flooding and spotting, vacuity heat with vexation and thirst, roundworm reversal with abdominal pain, outcrop of sore and welling abscess.",NA,Astringent Medicinal,收涩药,HERB005742,414,NA,NA,NA,NA,NA,NA,NA,NA,NA,"Wumei, a traditional Chinese medicine name. The dried and nearly ripe fruit of Prunus mume Siebold&Zucc, a plant in the Rosaceae family. Cultivated in various parts of China, with the provinces south of the Yangtze River Basin having the most. It has the effects of regulating the lungs, astringent the intestines, promoting fluid production, and relieving roundworms. Commonly used for lung deficiency and persistent cough, persistent diarrhea and dysentery, deficiency heat and thirst quenching, roundworm syncope, vomiting, and abdominal pain."
H00865,Firmiana simplex,Phoenix Tree Bast,WU TONG BAI PI,梧桐白皮,NA,NA,bast,"To lower cholesterol, clear heat and calm liver, dispel wind and eliminate damp, quicken blood and relieve pain.","Hyperlipemia, hypertension, wind-damp impediment pain, knocks and falls, menstrual disorder, hemorrhoids, erysipelas.",NA,NA,NA,HERB005754,NA,NPO12068,190243,Eukaryota,Viridiplantae,Streptophyta,Magnoliopsida,Malvales,Malvaceae,Firmiana,NA
H00866,NA,Radix Firmianae plantanifoliae,WU TONG GEN,梧桐根,NA,NA,NA,NA,NA,NA,NA,NA,HERB005755,NA,NA,190243,Eukaryota,Viridiplantae,Streptophyta,Magnoliopsida,Malvales,Malvaceae,Firmiana,NA
H00867,NA,Flos Firmianae plantanifoliae,WU TONG HUA,梧桐花,NA,NA,NA,NA,NA,NA,NA,NA,HERB005756,NA,NA,190243,Eukaryota,Viridiplantae,Streptophyta,Magnoliopsida,Malvales,Malvaceae,Firmiana,NA
H00868,Firmiana simplex,Phoenix Tree Leaf,WU TONG YE,梧桐叶,NA,NA,leaf,"To lower cholesterol, clear heat and calm liver, dispel wind and eliminate damp, clear heat and resolve toxin.","Hyperlipemia, hypertension, wind-damp pain, numbness and paralysis, swelling toxin of sore and welling abscess, hemorrhoids, shank sore, bleeding due to external injury, hypertension.",NA,NA,NA,HERB005757,NA,NPO12068,190243,Eukaryota,Viridiplantae,Streptophyta,Magnoliopsida,Malvales,Malvaceae,Firmiana,NA
H00869,NA,Semen Firmiae,WU TONG ZI,梧桐子,NA,NA,seed,NA,"Hyperlipemia, food damage, stomachache, mounting qi, infant mouth sore.",NA,Digestants,消食药,HERB005758,419,NA,190243,Eukaryota,Viridiplantae,Streptophyta,Magnoliopsida,Malvales,Malvaceae,Firmiana,NA
